116th Bill Name,117th Bill Name,Cosine Score,Matches,Short Title,Long Title
116-HB8189,117-HB1293,0.8471277074134752,short,To amend the Help America Vote Act of 2002 to prohibit a State from counting a ballot cast in an election for Federal office which is received by the State after the date of the election.,
116-HB3136,117-HB2097,0.9616462054612274,long,,"To direct the Secretary of Energy to establish a program for the interim storage of high-level radioactive waste and spent nuclear fuel, and for other purposes."
116-HR319,117-HR358,0.954772168186811,short,"Recognizing and supporting the goals and ideals of ""National Sexual Assault Awareness and Prevention Month"".",
116-HB611,117-HB2223,0.9647354710081593,short,Child Interstate Abortion Notification Act,
116-HB2817,117-HB2223,0.9554299325061628,long,,"To amend title 18, United States Code, to prohibit taking minors across State lines in circumvention of laws requiring the involvement of parents in abortion decisions."
116-HR174,117-HR682,0.9869753165499816,short,Recognizing the self-determination of Gibraltar to determine its status as a British Overseas Territory.,
116-HR323,117-HR436,0.9583302064364703,short,"Supporting State, local, and community initiatives to encourage parents, teachers, camp counselors, and childcare professionals to take measures to prevent sunburns in the minors they care for, and expressing the sense of the House of Representatives that State, local, and community entities should continue to support efforts to curb the incidences of skin cancer beginning with childhood skin protection.",
116-HB3547,117-HB5322,0.9281973509271346,short,Students and Young Consumers Empowerment Act,
116-HB7122,117-HB1323,0.9797618651410783,short,Taxpayer Receipt Act,
116-HB8521,117-HB7021,0.9454364017155487,short,Landowner Easement Rights Act,
116-HB1782,117-HB7717,0.9596537664248366,short,American Apprenticeship Act,
116-HB5935,117-HB225,0.9673450828464718,long,,"To amend chapter 44 of title 18, United States Code, to more comprehensively address the interstate transportation of firearms or ammunition."
116-HB175,117-HB225,0.9748910957017034,short,"To amend chapter 44 of title 18, United States Code, to more comprehensively address the interstate transportation of firearms or ammunition.",
116-HB4934,117-HB620,0.9419806744310012,short,Dignity for Aborted Children Act,
116-HB8516,117-HB2651,0.8486560666143663,long,,"To provide for the retrocession of the District of Columbia to Maryland, and for other purposes."
116-HB8539,117-HB2651,0.9638520698110917,short,District of Columbia-Maryland Reunion Act,
116-HB8949,117-HB2809,0.9809351876473337,long,,"To authorize the President to provide disaster assistance to States and Indian Tribes under a major disaster recovery program, and for other purposes."
116-HB3882,117-HB4163,0.9908958012708957,short,Even Playing Field Act,
116-HB8333,117-HB2515,0.9436574872535923,long,,"To amend the National Environmental Policy Act of 1969 to clarify ambiguous provisions, align the Act with relevant case law, reflect modern technologies, optimize interagency coordination, and facilitate a more efficient, effective, and timely environmental review process."
116-HB1246,117-HB4524,0.96519994132433,short,Improving Access to Work Act,
116-HB5198,117-HB6519,0.9680384479200645,long,,"To amend the Federal Food, Drug, and Cosmetic Act regarding the patient medication information required to be included in the labeling of prescription drugs, and for other purposes."
116-HB1103,117-HB270,0.956425791835452,short,Genetically Engineered Salmon Labeling Act,
116-HR654,117-HR30,0.9832003824516308,short,Supporting the United Nations Sustainable Development Goals.,
116-HB6689,117-HB2994,0.9306873519145885,short,Accountability for Acting Officials Act,
116-HB6472,117-HB675,0.9473391665448823,short,COVID–19 Price Gouging Prevention Act,
116-HB5306,117-HB4143,0.9712313706779078,long,,To amend title XI of the Social Security Act to clarify the mailing requirement relating to social security account statements.
116-HB5761,117-HB1361,0.9713971270059445,short,AUTO for Veterans Act Advancing Uniform Transportation Opportunities for Veterans Act,
116-HB7456,117-HB987,0.9803473363839424,short,"To establish a grant program for domestic maritime workforce training and education, and for other purposes.",
116-HB9057,117-HB6149,0.9822379080734814,long,,"To amend the Public Health Service Act to develop and test an expanded and advanced role for direct-care workers who provide long-term services and supports to older adults and people with disabilities in efforts to coordinate care and improve the efficiency of service delivery, and for other purposes."
116-HB1082,117-HB2145,0.9314834725656517,short,SASCA Survivors’ Access to Supportive Care Act,
116-HB1262,117-HB4992,0.9857112598574973,short,21 to Buy Act,
116-HB5145,117-HB1341,0.9722718461741492,short,Promoting Women in Trucking Workforce Act,
116-HB3688,117-HB232,0.9189416685853194,short,Public Service Transparency Act,
116-HB3119,117-HB1731,0.9704544132013351,short,BEST Act Biliteracy Education Seal and Teaching Act,
116-HB5016,117-HB5897,0.9532475820921706,short & long,Fair and Clear Campaign Transparency Act,To direct the Federal Communications Commission to promulgate regulations requiring material in the online public inspection file of a covered entity to be made available in a format that is machine-readable.
116-HB5718,117-HB3979,0.9676326276946754,long,,"To establish a refund effective date for rates and charges under the Natural Gas Act, and for other purposes."
116-HB8610,117-HB7193,0.9491889188674214,long,,"To withdraw normal trade relations treatment from, and apply certain provisions of title IV of the Trade Act of 1974 to, products of the People's Republic of China, and to expand the eligibility requirements for products of the People's Republic of China to receive normal trade relations treatment in the future, and for other purposes."
116-HB3563,117-HB3993,0.9885039293295969,short,Stop Shackling and Detaining Pregnant Women Act,
116-HJR5,117-HJR2,0.9713927724354988,short,Proposing an amendment to the Constitution of the United States relative to balancing the budget.,
116-HB126,117-HB126,0.9853053198070054,short,Students Voicing Opinions in Today’s Elections (VOTE) Act,
116-HB3822,117-HB3097,0.7834688043681792,short,Green Transportation Act,
116-HB409,117-HB1425,0.9936838310305971,short,To amend the Internal Revenue Code of 1986 to repeal the limitation on the cover over of distilled spirits taxes to the Virgin Islands and Puerto Rico.,
116-HB645,117-HB2301,0.9918738302737745,short,Automatic Voter Registration Act,
116-HCR12,117-HCR12,0.9360506576087623,short,Expressing the sense of Congress that a commemorative postage stamp should be issued in honor of the Buffalo Soldiers.,
116-HB1351,117-HB2739,0.9226635089726262,short,SURVIVE Act Securing Urgent Resources Vital to Indian Victim Empowerment Act,
116-HB7748,117-HB1545,0.9211256995484778,short,Crisis Counseling Act,
116-HB370,117-HB3078,0.9679094480576479,short,Pipeline and LNG Facility Cybersecurity Preparedness Act,
116-HB5844,117-HB9445,0.9263482882992071,short,ACCESS Rural America Act Access to Capital Creates Economic Strength and Supports Rural America Act,
116-HB734,117-HB576,0.9469527594843278,short,Next Generation Votes Act,
116-HB1708,117-HB1075,0.9495328796256817,short,Rim of the Valley Corridor Preservation Act,
116-HB5546,117-HB546,0.9800581506208303,short,Effective Assistance of Counsel in the Digital Era Act,
116-HB3280,117-HB3834,0.9261292858046936,short,LGBTQ Essential Data Act,
116-HB7799,117-HB1809,0.9561509881070421,short,"To designate a portion of United States Route 80 in Alabama as the ""John R. Lewis Voting Rights Highway"", and for other purposes.",
116-HB200,117-HB416,0.9781872564133196,short,Border Wall Trust Fund Act,
116-HB8292,117-HB6765,0.6414034010533565,short & long,FUELS Act Farmers Undertake Environmental Land Stewardship Act,"To amend the Water Resources Reform and Development Act of 2014 with respect to the application of the Spill Prevention, Control, and Countermeasure rule to certain farms, and for other purposes."
116-HB5421,117-HB2209,0.9602891622731681,long,,To amend the Controlled Substances Act to list fentanyl-related substances as schedule I controlled substances.
116-HB2935,117-HB2209,0.9704246984593637,short,Stopping Overdoses of Fentanyl Analogues Act,
116-HB3891,117-HB4090,0.9750123380659319,short,Making Education Affordable and Accessible Act,
116-HB2993,117-HB4758,0.9739583882714722,short,Steel Industry Preservation Act,
116-HB7335,117-HB1042,0.912435274487628,short,Protecting Critical Infrastructure Act,
116-HB5046,117-HB1115,0.9625121453555815,short,Global War on Terrorism Memorial Location Act,
116-HB6235,117-HB9490,0.9717653927949965,short,NETWORKS Act Neutralizing Emerging Threats from Wireless OEMs Receiving direction from Kleptocracies and Surveillance states Act,
116-HB5831,117-HB534,0.9361938531943657,short,Protecting Life in Foreign Assistance Act,
116-HB433,117-HB3567,0.926924367924564,short,Veterans’ Entry to Apprenticeship Act,
116-HB5941,117-HB116,0.9613625685779048,short,Equal Rights and Access for the Women of South Sudan Act,
116-HB7787,117-HB601,0.9123585795455125,short,Invest Now Act,
116-HB8889,117-HB5905,0.9584065607446541,long,,"To amend title 38, United States Code, to extend to Black veterans of World War II, and surviving spouses and certain direct descendants of such veterans, eligibility for certain housing loans and educational assistance administered by the Secretary of Veterans Affairs, and for other purposes."
116-HB5266,117-HB5173,0.9672042011025803,long,,"To provide for the enhancement of urban agriculture, and for other purposes."
116-HCR74,117-HCR25,0.9331846409011656,short,Encouraging the Architect of the Capitol to transition to the exclusive use of electricity derived from renewable energy sources to power the United States Capitol Complex by 2032.,
116-HB8701,117-HB2669,0.9356490426101217,short & long,FEMA Loan Interest Payment Relief Act,"To amend the Robert T. Stafford Disaster Relief and Emergency Assistance Act to provide for the authority to reimburse local governments or electric cooperatives for interest expenses, and for other purposes."
116-HB6087,117-HB251,0.9779351185362264,short & long,Public Service Appreciation Through Loan Forgiveness Act,"To amend the Higher Education Act of 1965 to create a reduction schedule for public service loan forgiveness, and for other purposes."
116-HB8845,117-HB1946,0.9310829086955771,long,,To amend title XVIII of the Social Security Act to provide for Medicare coverage of multi-cancer early detection screening tests.
116-HB7042,117-HB7932,0.9721030170501825,short & long,Foster Youth and Driving Act,To amend title IV of the Social Security Act to expand foster parent training and authorize new appropriations to support the obtainment of a driver's license.
116-HB6571,117-HB7315,0.9848097638265224,short,TEAM Veteran Caregivers Act Transparency and Effective Accountability Measures for Veteran Caregivers Act,
116-HB1454,117-HB1752,0.981430601256406,short & long,COOL OFF Act Choosing Our Own Lives Over Fast Firearms Act,"To provide for a 3-day waiting period before a person may receive a handgun, with exceptions."
116-HB5724,117-HB1292,0.9734014774543419,short,Same-Day Accountability for Veterans Enhancement Act,
116-HB7630,117-HB3072,0.9665648898621366,short & long,COACH Act Convening Operations Assistance for Childcare Heroes Act,"To amend the Small Business Act to require the Administrator of the Small Business Administration to publish or update a resource guide for small business concerns operating as child care providers, and for other purposes."
116-HB588,117-HB5456,0.9827732197548611,short,Federal Employees Civil Relief Act,
116-HB3800,117-HB5711,0.8705876799588109,long,,To modify the Federal TRIO programs.
116-HJR37,117-HJR87,0.9508939794390194,short,Directing the removal of United States Armed Forces from hostilities in the Republic of Yemen that have not been authorized by Congress.,
116-HB5442,117-HB2484,0.9653709708641872,short & long,Lowest Price for Patients Act,"To amend title XXVII of the Public Health Service Act and title XVIII of the Social Security Act to require pharmacies to disclose any differential between the cost of a prescription drug based on whether certain individuals use prescription drug coverage to acquire such drug, and for other purposes."
116-HR23,117-HR109,0.9021905341204215,short,Expressing the sense of the House of Representatives that the United States Postal Service should take all appropriate measures to ensure the continuation of door delivery for all business and residential customers.,
116-HB1003,117-HB2233,0.9605665944047153,short,Aretha Franklin Congressional Gold Medal Act,
116-HB8341,117-HB4762,0.9749349462303908,short & long,Workplace Choice and Flexibility for Individuals with Disabilities Act,To amend the Rehabilitation Act of 1973 to clarify the definition of competitive integrated employment.
116-HB4676,117-HB599,0.9610680412129737,short,Protecting Medicare Beneficiaries with Pre-Existing Conditions Act,
116-HB5576,117-HB3971,0.9562310795580372,short & long,Double Dip Elimination Act,"To amend title II of the Social Security Act to prevent concurrent receipt of unemployment benefits and Social Security disability insurance, and for other purposes."
116-HB6765,117-HB5778,0.9488761723573806,short,Security After Sandy Act,
116-HR1136,117-HR1353,0.9737277917463261,short,Recognizing Hispanic Heritage Month and celebrating the heritage and culture of Latinos in the United States and the immense contributions of Latinos to the United States.,
116-HR561,117-HR1353,0.9651158529161797,short,Recognizing Hispanic Heritage Month and celebrating the heritage and culture of Latinos in the United States and the immense contributions of Latinos to the United States.,
116-HB2308,117-HB1125,0.9692750939259897,short,To amend the VA MISSION Act of 2018 to expand the veterans healing veterans medical access and scholarship program to include more students and schools.,
116-HB2487,117-HB8687,0.9298084575461859,short,Wounded Warrior Workforce Enhancement Act,
116-HB921,117-HB2603,0.9717255443971163,short,To establish the policy of the United States regarding the no-first-use of nuclear weapons.,
116-HB6970,117-HB84,0.9530240761593458,long,,"To prevent States from receiving Federal financial assistance if such States tax the income of an out-of-State volunteer providing assistance during a disaster or emergency, and for other purposes."
116-HB1171,117-HB1813,0.9465278314172193,short,FASTER Act Funding for Aviation Screeners and Threat Elimination Restoration Act,
116-HB1411,117-HB4188,0.9388366467746925,short,Respect for Peace Corps Volunteers Act,
116-HR1222,117-HR54,0.9745855048679022,short,"Reaffirming the sense of the House of Representatives that the United States must lead the world in preventing further nuclear proliferation, while also reducing and eventually eliminating all nuclear weapons.",
116-HB3767,117-HB5850,0.94679430496886,short,Impacts and Outcomes for Health Career Training Act,
116-HB8450,117-HB373,0.9231998133513711,short,To treat certain face coverings and disinfectants as medical expenses for purposes of certain Federal tax benefits.,
116-HB8340,117-HB5865,0.9616152000196825,short,"To designate the facility of the United States Postal Service located at 4110 Bluebonnet Drive in Stafford, Texas, as the ""Leonard Scarcella Post Office Building"".",
116-HB4116,117-HB2280,0.8615657704631196,short & long,Prevent Gun Trafficking Act,"To amend title 18, United States Code, to combat straw purchases of firearms and deter firearms trafficking."
116-HB8786,117-HB4262,0.9526475825421649,short,Increasing Investor Opportunities Act,
116-HB1370,117-HB3087,0.9508857879631955,short,Breast Cancer Patient Equity Act,
116-HB8948,117-HB4798,0.9817638756852805,long,,"To authorize the Administrator of the Environmental Protection Agency to enter into cooperative agreements with States to carry out grant programs to assist in remediation and relocation efforts relating to hazardous air pollution, and for other purposes."
116-HB7387,117-HB660,0.9855183099680126,long,,"To require the Secretary of Commerce to establish a grant program to benefit coastal habitats, resiliency, and the economy, and for other purposes."
116-HB7362,117-HB1060,0.9844790292866623,long,,"To amend the Communications Act of 1934 to streamline siting processes for personal wireless service facilities, including small personal wireless service facilities, and for other purposes."
116-HR606,117-HR495,0.9701215160103681,short & long,"Calling for sickle cell trait research, surveillance, and public education and awareness, and for other purposes.","Calling for sickle cell trait research, surveillance, and public education and awareness, and for other purposes."
116-HB5923,117-HB8668,0.9687320672894155,short,Fair Access to Co-ops for Veterans Act,
116-HB1709,117-HB849,0.9742308290879753,short,Scientific Integrity Act,
116-HB4362,117-HB5799,0.9527894789724278,short,Overseas Americans Financial Access Act,
116-HB5804,117-HB2795,0.9252485661053805,short & long,DHS Blue Campaign Enhancement Act,"To amend the Homeland Security Act of 2002 to enhance the Blue Campaign of the Department of Homeland Security, and for other purposes."
116-HB7775,117-HB2746,0.9490425723900688,short,"To amend title 28, United States Code, to redefine the eastern and middle judicial districts of North Carolina.",
116-HB7623,117-HB4632,0.9564334914109611,short,Passport Backlog Elimination Act,
116-HB5943,117-HB133,0.9700330396172037,long,,"To enhance Federal enforcement of hate crimes, and for other purposes."
116-HB6026,117-HB1110,0.9502074949841363,short & long,Civil Rights Legacy Protection Act,"To prohibit the destruction of civil rights memorials, and for other purposes."
116-HJR20,117-HJR66,0.9746188678275067,short,Proposing an amendment to the Constitution of the United States to limit the number of terms that a Member of Congress may serve.,
116-HB6728,117-HB843,0.9438959831265444,short,To amend the Commodity Credit Corporation Charter Act to raise the borrowing limit of the Commodity Credit Corporation.,
116-HR119,117-HR923,0.9393819516891662,short,Supporting the goals and ideals of Career and Technical Education Month.,
116-HR864,117-HR923,0.9411142322595566,short,Supporting the goals and ideals of Career and Technical Education Month.,
116-HR969,117-HR1120,0.9472729510180893,short,"Recognizing ""National Public Works Week"".",
116-HR392,117-HR1120,0.9502869390199455,short,"Recognizing ""National Public Works Week"".",
116-HB2103,117-HB2549,0.94458744010502,short,Tax Fairness for Workers Act,
116-HJR33,117-HJR89,0.9908565759676681,short,Proposing an amendment to the Constitution of the United States relating to contributions and expenditures with respect to Federal elections.,
116-HB3283,117-HB4368,0.9601512748614479,short,"To amend title 4, United States Code, to permit the flag of the United States to be flown at half-staff in the event of the death of the Mayor of the District of Columbia.",
116-HB6770,117-HB2514,0.8815352957205304,short,"Mobility Options, Resiliency, and Efficiency (MORE) through TDM Act",
116-HR1213,117-HR50,0.958528172790293,short,Expressing the support of the House of Representatives for the naming of new or undedicated facilities of the Department of Veterans Affairs after women veterans and minority veterans in order to reflect the diversity of all who have served in the Armed Forces of the United States.,
116-HB8974,117-HB5915,0.9675915267175998,short,FHA Fairness Act,
116-HB5421,117-HB1910,0.6217222157140868,long,,To amend the Controlled Substances Act to list fentanyl-related substances as schedule I controlled substances.
116-HB2049,117-HB193,0.9207660145259126,short,Unaccompanied Alien Children Assistance Control Act,
116-HR792,117-HR889,0.9734293725896677,short,Supporting the contributions of Catholic schools.,
116-HR51,117-HR889,0.947252816077706,short,Supporting the contributions of Catholic schools.,
116-HB8558,117-HB469,0.9239473766761873,long,,To amend the Employee Retirement Income Security Act of 1974 to provide for health coverage of nipple-areolar complex tattooing in connection with reconstructive surgery following mastectomy and to amend titles XVIII and XIX of the Social Security Act to extend coverage of certain breast reconstructive services following mastectomy under the Medicare and Medicaid programs.
116-HB3515,117-HB830,0.9349867859567609,short,Wage Increase Fairness Act,
116-HR769,117-HR850,0.9383507597881615,short,Expressing the sense of the House of Representatives that the symbols and traditions of Christmas should be protected for use by those who celebrate Christmas.,
116-HB5463,117-HB6526,0.8691693713164647,long,,"To amend the Richard B. Russell National School Lunch Act to require a study of the time and duration of school lunch periods, and for other purposes."
116-HB8873,117-HB5953,0.9659137374211157,short,Investing in VETS Act Investing in Veteran Entrepreneurial Talents Act,
116-HB7465,117-HB1365,0.9531592642246927,short,Andrew Jackson Statue Removal Act,
116-HB1055,117-HB556,0.9634011240390289,short,"Global Health, Empowerment and Rights Act",
116-HR162,117-HR927,0.9809965805632362,short,"Expressing the condolences of the House of Representatives and honoring the memory of the victims of the mass shooting in Aurora, Illinois, on February 15, 2019.",
116-HB173,117-HB8847,0.9650295632928751,short,Pipeline Fairness and Transparency Act,
116-HB5097,117-HB3724,0.9530259070749747,short & long,Total Recall Act,"To require greater notification to the public regarding product recalls, and for other purposes."
116-HB6709,117-HB3020,0.9759273058625136,short,Coronavirus Frontline Workers Fair Pay Act,
116-HB286,117-HB2836,0.9048739711990609,short,Florida Coastal Protection Act,
116-HB7355,117-HB1055,0.9524546221601566,short,Federal Broadband Deployment Tracking Act,
116-HB8207,117-HB2195,0.9328647827855323,long,,"To amend title 38, United States Code, to clarify the scope of procedural rights of members of the uniformed services with respect to their employment and reemployment rights, and for other purposes."
116-HB8237,117-HB2195,0.9589596640578535,short & long,Protecting the Employment Rights of Servicemembers Act,"To amend title 38, United States Code, to clarify the scope of procedural rights of members of the uniformed services with respect to their employment and reemployment rights, and for other purposes."
116-HCR90,117-HCR74,0.9533671645603374,short,Authorizing the use of the Capitol Grounds for the National Peace Officers Memorial Service and the National Honor Guard and Pipe Band Exhibition.,
116-HCR16,117-HCR74,0.8734705762573334,short,Authorizing the use of the Capitol Grounds for the National Peace Officers Memorial Service and the National Honor Guard and Pipe Band Exhibition.,
116-HB6940,117-HB3708,0.967398246700377,short,Advancing Tech Startups Act,
116-HB8287,117-HB47,0.9365915347339961,short,"To amend title 54, United States Code, to increase public access to recreational areas on Federal land.",
116-HB8595,117-HB236,0.9765060769585441,short,To nullify the effect of Executive Order 13950 relating to combating race and sex stereotyping.,
116-HB5590,117-HB234,0.964307780283664,short & long,Korean American VALOR Act Korean American Vietnam Allies Long Overdue for Relief Act,"To amend title 38, United States Code, to treat certain individuals who served in Vietnam as a member of the armed forces of the Republic of Korea as a veteran of the Armed Forces of the United States for purposes of the provision of health care by the Department of Veterans Affairs."
116-HB3374,117-HB1443,0.9106937511102362,short,LGBTQ Business Equal Credit Enforcement and Investment Act,
116-HB8583,117-HB9305,0.90471005590174,long,,"To amend the Worker Adjustment and Retraining Notification Act to require employers who are ordering a plant closing or mass layoff to cover the cost of an economic impact study in each impacted unit of local government, and for other purposes."
116-HB1469,117-HB4537,0.9502678098875661,short,Improving Transparency in TANF through Data Act,
116-HB1341,117-HB1737,0.954761850488685,short,"To designate the Mental Health Residential Rehabilitation Treatment Facility Expansion of the Department of Veterans Affairs Alvin C. York Medical Center in Murfreesboro, Tennessee, as the ""Sergeant John Toombs Residential Rehabilitation Treatment Facility"".",
116-HB879,117-HB510,0.9127908453339633,short,Support Local Transportation Act,
116-HB5034,117-HB2135,0.9099163779531059,short,Fair Debt Collection Improvement Act,
116-HB1750,117-HB492,0.9391141886435413,short,Supporting Veteran Families in Need Act,
116-HB1350,117-HB9590,0.9633246169899623,short,Corey Adams Searchlight Act,
116-HB4843,117-HB1432,0.9911608650760457,short,Susan Harwood Training Grant Program Authorization Act,
116-HB168,117-HB168,0.9702009319317794,short,Reentry and Reunification Act,
116-HB7689,117-HB3467,0.9814333283104832,short & long,Improving Data Collection for Adverse Childhood Experiences Act,"To amend the Public Health Service Act to direct the Secretary of Health and Human Services, acting through the Director of the Centers for Disease Control and Prevention, to support research and programmatic efforts that will build on previous research on the effects of adverse childhood experiences."
116-HB3392,117-HB3410,0.947660678158388,short,To prohibit Federal funding of National Public Radio and the use of Federal funds to acquire radio content.,
