116th Bill Name,117th Bill Name,Cosine Score,Matches,Short Title,Long Title
116-HB236,117-HB178,0.9307103640951288,short,"No Budget, No Pay Act",
116-HB4381,117-HB6214,0.8361689279425144,short,Elementary and Secondary School Counseling Act,
116-HB7482,117-HB4763,0.982061222021123,short,Future of Agricultural Resiliency And Modernization Act,
116-HB4959,117-HB3869,0.9363146528643769,short,Pro-Growth Budgeting Act,
116-HB5230,117-HB7055,0.9373617646249084,short,Elijah E. Cummings Family Asthma Act,
116-HB918,117-HB774,0.9168162118250219,short,Spotlight Act,
116-HB1299,117-HB8376,0.9348401920992422,short,Peggy Frank Memorial Act,
116-HB6856,117-HB4333,0.979519765110507,short,To amend the Internal Revenue Code of 1986 is amended to allow a deduction for investment advisory expenses of certain funeral and cemetery trusts during suspension of miscellaneous itemized deductions.,
116-HB2807,117-HB2232,0.9251813131576841,short,Help Students Vote Act,
116-HR792,117-HR66,0.9439488061981134,short,Supporting the contributions of Catholic schools.,
116-HR51,117-HR66,0.8618056627281103,short,Supporting the contributions of Catholic schools.,
116-HB8127,117-HB1762,0.9863394685897263,short,Protecting Indian Tribes from Scams Act,
116-HB5598,117-HB2794,0.9877701565956458,short,Boundary Waters Wilderness Protection and Pollution Prevention Act,
116-HB8885,117-HB5438,0.9622665581909355,long,,"To provide incentives for the purchase of water-efficient products, and for other purposes."
116-HB4641,117-HB2398,0.9144966275855018,short,Broadband Speed Act,
116-HB4326,117-HB6420,0.9470910360522226,short,Sex Trafficking Demand Reduction Act,
116-HR96,117-HR74,0.9522484113292426,short,Supporting the goals and ideals of Black History Month and honoring the outstanding contributions of African-American Congressional Medal of Honor recipients.,
116-HR157,117-HR181,0.9449704792394426,short,Restoring Integrity in Democracy Resolution,
116-HB8727,117-HB1332,0.9515504021598006,short,Telehealth Modernization Act,
116-HB3444,117-HB4379,0.9917410811714592,short & long,School Food Modernization Act,"To amend the Richard B. Russell National School Lunch Act to require the Secretary of Agriculture to make loan guarantees and grants to finance certain improvements to school lunch facilities, to train school food service personnel, and for other purposes."
116-HB4420,117-HB2033,0.8990459564520976,short & long,Timely Mental Health for Foster Youth Act,To amend subpart 1 of part B of title IV of the Social Security Act to ensure that mental health screenings and assessments are provided to children and youth upon entry into foster care.
116-HB3160,117-HB478,0.8792555218662106,short,Blackwater Trading Post Land Transfer Act,
116-HR234,117-HR276,0.946941016330805,short,"Recognizing the heritage, culture, and contributions of Latinas in the United States.",
116-HB7509,117-HB2463,0.9712437477222782,short,TSA Second Screening Act,
116-HB8717,117-HB4854,0.9827577970372137,short,FAIR Meat Packing Act Feed America by Incentivizing Rural Meat Packing Act,
116-HCR122,117-HCR122,0.9550637746598731,short,Recognizing the significance of equal pay and the disparity in wages paid to Latina women in comparison to men.,
116-HCR76,117-HCR122,0.9904797650553288,short,Recognizing the significance of equal pay and the disparity in wages paid to Latina women in comparison to men.,
116-HR687,117-HR464,0.9834804034887762,short,"Expressing support for the designation of July 16 as ""National Atomic Veterans Day"".",
116-HB1042,117-HB1442,0.944067516607944,short,PREPARED Act Providing Responsible Emergency Plans for Animals at Risk of Emerging Disasters Act,
116-HB6153,117-HB9335,0.9574903809781006,short,"To designate the facility of the United States Postal Service located at 410 Franklin Street in Appleton, Wisconsin, as the ""Mitchell F. Lundgaard Post Office Building"".",
116-HB3319,117-HB206,0.9243650182985673,short,Paperwork Reduction for Farmers and H–2A Modernization Act,
116-HB7333,117-HB1039,0.9064465749277545,short,Coastal Broadband Deployment Act,
116-HB2850,117-HB9072,0.9524162835589814,short,Humane Retirement Act,
116-HB8881,117-HB2453,0.907841315778508,long,,"To provide grants to States that do not suspend, revoke, or refuse to renew a driver's license of a person or refuse to renew a registration of a motor vehicle for failure to pay a civil or criminal fine or fee, and for other purposes."
116-HB4885,117-HB6362,0.9859796588316281,short,McIntire-Stennis Act District of Columbia Equality Act,
116-HB8216,117-HB2878,0.9758272198983811,short,Native VetSuccess at Tribal Colleges and Universities Pilot Program Act,
116-HB3267,117-HB1933,0.9695873431263152,short,END ALL Hazing Act Educational Notification and Disclosure of Actions risking Loss of Life by Hazing Act,
116-HB4550,117-HB2178,0.9238697464199938,short,Minority Diabetes Initiative Act,
116-HB4678,117-HB4555,0.9491078150561254,long,,To amend the Public Health Service Act to authorize a public education campaign across all relevant programs of the Health Resources and Services Administration to increase oral health literacy and awareness.
116-HB4006,117-HB2132,0.9560853477418358,long,,"To require regulation of wastes associated with the exploration, development, or production of crude oil, natural gas, or geothermal energy under the Solid Waste Disposal Act, and for other purposes."
116-HB2642,117-HB999,0.9099752587951069,short,Wild Olympics Wilderness and Wild and Scenic Rivers Act,
116-HB6118,117-HB1467,0.9600921798316888,short,Menstrual Equity in the Peace Corps Act,
116-HB5469,117-HB1475,0.9761740283975401,short & long,Pursuing Equity in Mental Health Act,"To address mental health issues for youth, particularly youth of color, and for other purposes."
116-HB3975,117-HB3353,0.9134811563271017,short,Contact Lens Prescription Verification Modernization Act,
116-HB7565,117-HB164,0.857344921346079,short,"To authorize the Seminole Tribe of Florida to lease or transfer certain land, and for other purposes.",
116-HB2102,117-HB7089,0.9774543787467193,short,VET PFAS Act Veterans Exposed to Toxic PFAS Act,
116-HB8195,117-HB1960,0.9285168747627425,short,"To name the Department of Veterans Affairs community-based outpatient clinic, located at 400 College Drive, Middleburg, Florida, the ""A.K. Baker VA Clinic"".",
116-HB8929,117-HB8126,0.9847753685551551,short & long,Default Proceed Sale Transparency Act,"To improve the procedures of the national instant criminal background check system in the case of firearm transfers by federally licensed firearms importers, manufacturers, and dealers before the completion of the related criminal background check, and to provide for annual reports on default firearm transfers."
116-HB1714,117-HB1694,0.9880290075874616,short,Stop Militarizing Law Enforcement Act,
116-HB7868,117-HB2771,0.9680296887140382,long,,"To amend the Public Health Service Act to improve the health and well-being of maltreated infants and toddlers through the implementation of infant-toddler court teams within States, and for other purposes."
116-HR1044,117-HR1220,0.9844448277291378,short,Expressing support for the designation of Journeyman Lineworkers Recognition Day.,
116-HB1045,117-HB1340,0.9530487184318551,short,Immigrant Detainee Legal Rights Act,
116-HB217,117-HB1380,0.9594066421400246,short,Permanent Tax Relief for Working Families Act,
116-HB5441,117-HB2098,0.9278988951180654,short,To repeal the funding authorization sunset and the total funding cap for the Essex National Heritage Area.,
116-HB4027,117-HB8612,0.9407155301604456,short,Stop the Censorship Act,
116-HB7808,117-HB8612,0.9326695793228138,long,,"To amend section 230 of the Communications Act of 1934 (commonly referred to as the Communications Decency Act) to stop censorship, and for other purposes."
116-HB5862,117-HB643,0.9604653743153592,short,Stop Greenlighting Driver Licenses for Illegal Immigrants Act,
116-HB2907,117-HB8686,0.9627328905610627,short,Wounded Warrior Research Enhancement Act,
116-HJR53,117-HJR39,0.9678670485088061,short,Proposing an amendment to the Constitution of the United States to require that the Supreme Court be composed of not more than nine justices.,
116-HB1985,117-HB833,0.9324906891911303,short,Family Savings for Kids and Seniors Act,
116-HB4375,117-HB4261,0.9271647858442972,short,Pipeline Seismic Safety Study Act,
116-HB8348,117-HB4677,0.9842310464968921,short & long,New York-New Jersey Watershed Protection Act,"To direct restoration and protection of the New York-New Jersey watersheds and estuaries hydrologically connected to New York-New Jersey Harbor, and for other purposes."
116-HB8321,117-HB683,0.9415298093282464,long,,To promote diversity in the national apprenticeship system.
116-HB9056,117-HB1599,0.9225581155997404,short & long,Securing America’s Critical Minerals Supply Act,"To amend the Department of Energy Organization Act to secure the supply of critical energy resources, including critical minerals and other materials, and for other purposes."
116-HR16,117-HR55,0.9589488728753444,short,"Recognizing the importance of access to comprehensive, high-quality, life-affirming medical care for women of all ages.",
116-HR139,117-HR138,0.9538941034276966,short,Supporting the goals and ideals of International Mother Language Day in bringing attention to the importance of preserving linguistic and cultural heritage through education.,
116-HB6457,117-HB9284,0.9834701157613083,short,Disaster and Emergency Pricing Abuse Prevention Act,
116-HB5619,117-HB2955,0.960484221517606,short,Suicide Prevention Act,
116-HB3440,117-HB1802,0.9739849459674793,short & long,Do Your Job Act,"To amend the Legislative Reorganization Act of 1946 to reduce the rates of pay of Members of Congress during a fiscal year if Congress has not agreed to a concurrent resolution on the budget for such fiscal year, to repeal the automatic appropriation of funds for the salaries of Members of Congress, and for other purposes."
116-HB4271,117-HB5436,0.9600074339258671,short,Gun Suicide Prevention Act,
116-HB8924,117-HB2215,0.963063227738936,short & long,"Our Homes, Our Votes Act","To amend the National Voter Registration Act of 1993 to treat the lease for a dwelling unit under certain federally assisted housing programs as a simultaneous application for voter registration in elections for Federal office, to designate owners of dwelling units under certain federally assisted housing programs as voter registration agencies for purposes of such Act, and for other purposes."
116-HB3418,117-HB4631,0.9438404794368479,short,POST GRAD Act Protecting Our Students by Terminating Graduate Rates that Add to Debt Act,
116-HR410,117-HR294,0.9065671335165276,short,Encouraging reunions of divided Korean-American families.,
116-HB4963,117-HB4459,0.9761761496972097,long,,"To amend the Controlled Substances Act to clarify how controlled substance analogues that are imported or offered for import are to be regulated, and for other purposes."
116-HR755,117-HR24,0.8755298417732285,short,"Impeaching Donald John Trump, President of the United States, for high crimes and misdemeanors.",
116-HR13,117-HR24,0.9052305690262908,short,"Impeaching Donald John Trump, President of the United States, for high crimes and misdemeanors.",
116-HJR8,117-HJR4,0.9866626780891572,short,Proposing an amendment to the Constitution of the United States limiting the pardon power of the President.,
116-HB8060,117-HB2264,0.9541070599388252,short,Tele-Mental Health Improvement Act,
116-HB4484,117-HB742,0.9853879274284962,short & long,FLEX Act Flexibility Through Lower Expenses Health Care Act,"To require short-term limited duration insurance issuers to renew or continue in force such insurance coverage at the option of the enrollees, and for other purposes."
116-HB2655,117-HB3443,0.9573687281326295,short,Purple Heart Freedom to Work Act,
116-HB8534,117-HB6227,0.9615709985591899,long,,"To amend the Richard B. Russell National School Lunch Act to allow direct certification of children in households of active duty members of the Armed Forces for certain Federal school meal programs, and for other purposes."
116-HB2912,117-HB2974,0.959434112843648,short,Military Spouse Hiring Act,
116-HB8639,117-HB7254,0.7927219397204172,long,,"To authorize the Secretary of Health and Human Services to award grants to States and political subdivisions of States to hire, employ, train, and dispatch mental health professionals to respond in lieu of law enforcement officers in emergencies involving one or more persons with a mental illness or an intellectual or developmental disability, and for other purposes."
116-HB7987,117-HB6571,0.9211350388030523,short & long,TSA Security Threat Assessment Application Modernization Act,"To require the Transportation Security Administration to standardize the enrollment process for individuals applying for multiple TSA Security Threat Assessment programs, including the TWIC, HAZMAT Endorsement, and TSA PreCheck programs of the Administration, and for other purposes."
116-HB4080,117-HB130,0.9721506964123743,short & long,Kimberly Vaughan Firearm Safe Storage Act,"To require the safe storage of firearms and ammunition, and to require the investigation of reports of improper storage of firearms or ammunition."
116-HB5584,117-HB358,0.975005178862405,short,FRESH Trucking Act Freedom from Regulating Edible Supplies and Horticulture Trucking Act,
116-HB5152,117-HB3289,0.9236419046430765,short,Transportation Equity Act,
116-HB5315,117-HB7953,0.6961585439644262,short,Expanding Opportunity for MDIs Act Expanding Opportunity for Minority Depository Institutions Act,
116-HB6911,117-HB312,0.9174917262148617,short,"To provide a Federal income tax credit for State income taxes paid by individuals temporarily providing certain health or emergency services in the State, and to provide a corresponding reduction in Federal highway funds to the State.",
116-HB7567,117-HB1184,0.8799206305151165,long,,"To amend the Federal Food, Drug, and Cosmetic Act to improve the treatment of rare diseases and conditions, and for other purposes."
116-HB4788,117-HB2645,0.936254376117187,long,,To address the needs of workers in industries likely to be impacted by rapidly evolving technologies.
116-HB2088,117-HB425,0.975494940171548,short,"To amend the Energy Independence and Security Act of 2007 to reauthorize the Energy Efficiency and Conservation Block Grant Program, and for other purposes.",
116-HB5828,117-HB4209,0.9501508087760699,short,DHS Illicit Cross-Border Tunnel Defense Act,
116-HB7693,117-HB1863,0.9213530148620869,short,Public School Green Rooftop Program,
116-HB4456,117-HB3957,0.9816533708378059,short,Enhancing Detection of Human Trafficking Act,
116-HB3559,117-HB3036,0.928676194519443,short & long,Secure E-Waste Export and Recycling Act,"To control the export of electronic waste in order to ensure that such waste does not become the source of counterfeit goods that may reenter military and civilian electronics supply chains in the United States, and for other purposes."
116-HR1266,117-HR159,0.9801191975480955,short & long,"Expressing appreciation and support for essential employees with disabilities during the current pandemic, and beyond.","Expressing appreciation and support for essential employees with disabilities during the current pandemic, and beyond."
116-HB805,117-HB6606,0.9569191651291521,short,Robo COP Act Robo Calls Off Phones Act,
116-HB3337,117-HB4303,0.9547488897343728,short,Labor Market Response Act,
116-HR483,117-HR782,0.9488545797583824,short,Recognizing the importance and effectiveness of veteran-to-veteran sponsorship programs.,
116-HB4969,117-HB5929,0.9664979124692302,short,Las Cruces Bataan Memorial Clinic Act,
116-HB8283,117-HB708,0.9588058457201287,short,TREAT Act Temporary Reciprocity to Ensure Access to Treatment Act,
116-HB4509,117-HB2847,0.9483239922431451,short,"To amend the Internal Revenue Code of 1986 to restore the limitation on downward attribution of stock ownership in applying the constructive ownership rules to controlled foreign corporations, and for other purposes.",
116-HB3843,117-HB402,0.9533929369068705,short,CROOK Act Countering Russian and Other Overseas Kleptocracy Act,
116-HB3040,117-HB508,0.9197162447415426,short,SAFE Streets Act Safe And Friendly for the Environment Streets Act,
116-HB435,117-HB1576,0.986704838005923,short,National Gun Violence Research Act,
116-HR1038,117-HR398,0.9445549365208425,short,Recognizing the forthcoming centennial of the 1921 Tulsa Race Massacre.,
116-HB6107,117-HB4409,0.9576621705251988,short,Diversity Advancements in Accelerated Programs Act,
116-HR816,117-HR87,0.952740175456293,short,Recognizing the significance of the Greensboro Four sit-in.,
116-HR1205,117-HR1452,0.936001967730652,short,"Expressing support for the designation of October 28 as ""Oxi Day"" to commemorate the anniversary of Greek Prime Minister Ioannis Metaxas' answer of ""Oxi!"" or ""No!"" to surrender to the Axis forces, inflicting a fatal wound that helped save democracy for the world.",
116-HR644,117-HR1452,0.9586300382386757,short,"Expressing support for the designation of October 28 as ""Oxi Day"" to commemorate the anniversary of Greek Prime Minister Ioannis Metaxas' answer of ""Oxi!"" or ""No!"" to surrender to the Axis forces, inflicting a fatal wound that helped save democracy for the world.",
116-HB7270,117-HB5597,0.9646436008856455,long,,"To direct the Attorney General of the United States to submit to the Congress a report on Federal criminal offenses, and for other purposes."
116-HB6982,117-HB4774,0.9469373118236648,long,,"To amend the Natural Gas Act with respect to the rehearing process, and for other purposes."
116-HB30,117-HB930,0.9453800652414518,short,SAVES Act Saving America’s Endangered Species Act,
116-HB7172,117-HB2406,0.9128211100116783,short,Electric Power Infrastructure Improvement Act,
116-HB2731,117-HB1593,0.9370770883860705,long,,"To provide for automatic acquisition of United States citizenship for certain internationally adopted individuals, and for other purposes."
116-HB2991,117-HB5866,0.9438603000703586,short,Protection of Social Security Benefits Restoration Act,
116-HB6748,117-HB199,0.923540736989522,short,Direct Support for Communities Act,
116-HB6488,117-HB1069,0.9820795660241182,long,,"To amend the Communications Act of 1934 to provide that the Federal Communications Commission is not required to perform any review under the National Environmental Policy Act of 1969 or division A of subtitle III of title 54, United States Code, as a condition of permitting the placement and installation of a communications facility, and for other purposes."
116-HB7174,117-HB7625,0.9632048282997511,short & long,Protection of Civilians in Military Operations Act,"To enhance protections of civilians during United States military operations, and for other purposes."
116-HR1136,117-HR706,0.9166704012950626,short,Recognizing Hispanic Heritage Month and celebrating the heritage and culture of Latinos in the United States and the immense contributions of Latinos to the United States.,
116-HR561,117-HR706,0.9585745064272337,short,Recognizing Hispanic Heritage Month and celebrating the heritage and culture of Latinos in the United States and the immense contributions of Latinos to the United States.,
116-HCR10,117-HCR7,0.9847321076923838,short,Authorizing the use of the rotunda of the Capitol to honor the last surviving Medal of Honor recipient of the Second World War upon death.,
116-HB7842,117-HB1160,0.9732189464015675,short & long,INFLUENCE Act Intelligence on Nefarious Foreign Leaders Using Education Networks for Corrupt Enrichment Act,"To amend the Higher Education Act of 1965 to improve protections against foreign influence at institutions of higher education, and for other purposes."
116-HR520,117-HR628,0.968108190274223,short,Remembering kindness in the United States and affirming our commitment to fostering community and building resiliency through every day acts of kindness.,
116-HB2409,117-HB5128,0.9326725825430456,short,Expanding Access to Capital for Rural Job Creators Act,
116-HB6033,117-HB2627,0.9667259602597952,short & long,Pell to Grad Act,"To amend the Higher Education Act of 1965 to increase the period of eligibility for Federal Pell Grants, and for other purposes."
116-HR1240,117-HR356,0.8783174082022653,short,Expressing condemnation for police brutality wherever in the world it occurs.,
116-HB5898,117-HB3935,0.8667030202870232,short,Promoting Agricultural Commerce Act,
116-HB5231,117-HB463,0.9295945775595551,short,Transportation Alternatives Enhancements Act,
116-HB2895,117-HB3541,0.9655119651508536,short,Conrad State 30 and Physician Access Reauthorization Act,
116-HB7425,117-HB547,0.9081898256389358,short,DIRECT Act Direct Interstate Retail Exemption for Certain Transactions Act,
116-HB1011,117-HB529,0.9787250952654313,short,Protecting Sensitive Locations Act,
116-HB42,117-HB141,0.9485540864147726,short,FRIENDS Act First Responder Identification of Emergency Needs in Disaster Situations,
116-HB8312,117-HB6168,0.974047917156501,short & long,Future Generations Protection Act,"To amend the Clean Air Act to prohibit the emission of any greenhouse gas in any quantity from any new electric utility steam generating unit, and for other purposes."
116-HR1217,117-HR764,0.9295375090646496,short,Recognizing the religious and historical significance of the festival of Diwali.,
116-HB619,117-HB6389,0.9223089492694225,short,Human Trafficking Survivor Tax Relief Act,
116-HB4573,117-HB4399,0.9794411911337451,short,Accessing Higher Education Opportunities Act,
116-HB5339,117-HB2171,0.9528071680060756,short,Freedom To Invest in Tomorrow's Workforce Act,
116-HB3538,117-HB3357,0.9252842677481283,short,Rural Jobs Act,
116-HB839,117-HB511,0.9293166514354141,short,National Multimodal Freight Network Improvement Act,
116-HB6615,117-HB7054,0.9600807329508139,short,COVID–19 Oral History Project Act,
116-HB90,117-HB64,0.9509065904944811,short,Protection from Obamacare Mandates and Congressional Equity Act,
116-HB8034,117-HB1957,0.8890240269464164,long,,"To amend title 38, United States Code, to direct the Secretary of Veterans Affairs to provide coverage for infertility treatment and standard fertility preservation services, and for other purposes."
116-HB6632,117-HB162,0.9638588359265026,short & long,"To amend the CARES Act to provide for repayment terms for mortgages in forbearance, and for other purposes.","To amend the CARES Act to provide for repayment terms for mortgages in forbearance, and for other purposes."
116-HB5248,117-HB3642,0.9204506350820351,short,Harlem Hellfighters Congressional Gold Medal Act,
116-HB3818,117-HB784,0.9862767398294315,short,INFANT Act Infants Need Food And Nutrition Today Act,
116-HB7723,117-HB1385,0.97689779911295,long,,"To establish the position of Interagency Coordinator for Behavioral Health to coordinate the programs and activities of the Federal Government relating to mental health, and for other purposes."
116-HB8917,117-HB1287,0.9358983849833491,short & long,"To amend the Omnibus Parks and Public Lands Management Act of 1996 to extend the authorization of the South Carolina National Heritage Corridor, and for other purposes.","To amend the Omnibus Parks and Public Lands Management Act of 1996 to extend the authorization of the South Carolina National Heritage Corridor, and for other purposes."
116-HB8372,117-HB5439,0.9468273152106927,short & long,KIDS Act Kids Internet Design and Safety Act,"To keep children safe and protect their interests on the internet, and for other purposes."
116-HB2687,117-HB5744,0.8723044575511298,short,Customer Non-Discrimination Act,
116-HB1847,117-HB23,0.9682896982658696,short,Inspector General Protection Act,
116-HB5334,117-HB1898,0.9491951111683167,short & long,FOREST Act Funding Our Roads and Ecosystems Sustainably Together Act,"To amend the FAST Act to authorize appropriations for the United States Forest Service, and for other purposes."
116-HB751,117-HB823,0.9513609970640936,short,"No Vote, No Raise Act",
116-HB5118,117-HB3310,0.9488325954097572,short,Promoting Service in Transportation Act,
116-HB3241,117-HB4856,0.9507467657883147,short,Canadian Snowbird Visa Act,
116-HB1915,117-HB5588,0.9680615273506085,short,Net Price Calculator Improvement Act,
116-HB6542,117-HB1929,0.9610586294287907,short & long,Presidential Records Preservation Act,"To amend title 44, United States Code, to require the President make and preserve records, and for other purposes."
116-HJR20,117-HJR69,0.9755265533393959,short,Proposing an amendment to the Constitution of the United States to limit the number of terms that a Member of Congress may serve.,
116-HB6274,117-HB7577,0.9324916339296055,short,CDC Tribal Public Health Security and Preparedness Act,
116-HB2112,117-HB4986,0.9901212221869784,short,Refund to Rainy Day Savings Act,
116-HB5417,117-HB1687,0.9695375764917543,short & long,Significant Transnational Criminal Organization Designation Act,To amend the Immigration and Nationality Act to add membership in a significant transnational criminal organization to the list of grounds of inadmissibility and to prohibit the provision of material support or resources to such organizations.
116-HB210,117-HB600,0.9895663990592398,short,Presidential Inaugural Committee Oversight Act,
116-HB8928,117-HB6135,0.9622075641189174,short,Portable Generator Safety STANDARD Act Portable Generator Safety Standard To Avoid Needless Deaths And Reduce Disabilities Act,
