116th Bill Name,117th Bill Name,Cosine Score,Matches,Short Title,Long Title
116-HB7543,117-HB2295,0.9576964686972907,long,,"To amend title VII of the Public Health Service Act to provide for a loan repayment program for the HIV clinical and dental workforce, and for other purposes."
116-HB1193,117-HB1457,0.9588600272207078,short,Reclamation of War Powers Act,
116-HB3154,117-HB782,0.9800533201435101,short,Homeownership for DREAMers Act,
116-HB8755,117-HB2168,0.9208993350969894,short & long,Expanded Telehealth Access Act,"To amend title XVIII of the Social Security Act to expand the scope of practitioners eligible for payment for telehealth services under the Medicare program, and for other purposes."
116-HB81,117-HB6514,0.9539871305424766,short,To amend the Internal Revenue Code of 1986 to allow an above-the-line deduction for health insurance premiums.,
116-HB4711,117-HB6392,0.9304640909424895,short,No Tax Breaks for Drug Ads Act,
116-HB8044,117-HB144,0.9221774946334075,short,Supporting Early-Career Researchers Act,
116-HB8565,117-HB3716,0.9811330869184474,long,,"To require agencies to analyze how certain rules impact children, and for other purposes."
116-HB2611,117-HB6982,0.9825568468581016,short,Public Lands Telecommunications Act,
116-HB1787,117-HB4083,0.9593493045597103,short,Corey Jones Act,
116-HB5212,117-HB3746,0.9646648951646384,short,Accountable Care in Rural America Act,
116-HB7186,117-HB2854,0.9522856158385213,short & long,Utility Resilience and Reliability Act,"To amend the Federal Power Act to require the Electric Reliability Organization to propose a reliability standard that addresses the resilience of the bulk-power system, and for other purposes."
116-HB5578,117-HB6834,0.9704718925355568,long,,To provide for the mandatory recall of drugs regulated by the Food and Drug Administration.
116-HB4904,117-HB3653,0.9841521025972814,short & long,Smarter Approaches to Nuclear Expenditures Act,"To reduce spending on nuclear weapons and related defense spending and to prohibit the procurement and deployment of low-yield nuclear warheads, and for other purposes."
116-HB3252,117-HB3485,0.983599782511824,short,Global Respect Act,
116-HB2127,117-HB278,0.9499312068480796,short,No Taxpayer-Funded Art in Embassies Act,
116-HB1722,117-HB913,0.9319236231013289,short,Build a Better VA Act,
116-HB8643,117-HB4340,0.9630326504546876,short & long,PFAS Exposure Assessment and Documentation Act,"To direct the Secretary of Defense to include in periodic health assessments of members of the Armed Forces an evaluation of whether the member has been exposed to perfluoroalkyl substances and polyfluoroalkyl substances, and for other purposes."
116-HB7990,117-HB2538,0.9728142203671971,short,FENTANYL Results Act Fighting Emerging Narcotics Through Additional Nations to Yield Lasting Results Act,
116-HB5153,117-HB2074,0.9802161339815806,short,Indian Buffalo Management Act,
116-HR973,117-HR393,0.9716930108402294,short,"Recognizing the Muslim holy month of Ramadan, commending a month of fasting and spiritual renewal, and extending best wishes to Muslims in the United States and across the globe for a joyous and meaningful observance of Eid al-Fitr.",
116-HR424,117-HR393,0.9599512370136778,short,"Recognizing the Muslim holy month of Ramadan, commending a month of fasting and spiritual renewal, and extending best wishes to Muslims in the United States and across the globe for a joyous and meaningful observance of Eid al-Fitr.",
116-HB6902,117-HB1394,0.9704917024973392,short & long,Black History is American History Act,"To authorize the Secretary of Education to award grants to eligible entities to carry out educational programs that include the history of peoples of African descent in the settling and founding of America, the economic and political environments that led to the development, institutionalization, and abolition of slavery and its impact on all Americans, the exploration and expansion of America, impact on and contributions to the development and enhancement of American life, United States history, literature, the economy, politics, body of laws, and culture, and for other purposes."
116-HB3131,117-HB3771,0.8731558314012383,long,,"To amend the Public Health Service Act to provide for research and improvement of cardiovascular health among the South Asian population of the United States, and for other purposes."
116-HB3970,117-HB697,0.9710268500916742,short,Stop Subsidizing Multimillion Dollar Corporate Bonuses Act,
116-HR1214,117-HR1043,0.9604130740498513,short & long,Recognizing the accomplishments and contributions of Sikh Americans and Sikhs worldwide.,Recognizing the accomplishments and contributions of Sikh Americans and Sikhs worldwide.
116-HB4829,117-HB749,0.9658485031706776,short,Remote Seafood Employee Meals Tax Parity Act,
116-HB5376,117-HB1198,0.9498874959966981,short & long,END Child Exploitation Act Eliminate Network Distribution of Child Exploitation Act,"To amend title 18, United States Code, to require a provider of a report to the CyberTipline related to online sexual exploitation of children to preserve the contents of such report for 180 days, and for other purposes."
116-HB4211,117-HB3277,0.9804942923133242,short,Animal Welfare Enforcement Improvement Act,
116-HB1660,117-HB5972,0.9404314105957929,short,LEAP Act Leveraging and Energizing America’s Apprenticeship Programs Act,
116-HB1774,117-HB5972,0.80906637688758,short,LEAP Act Leveraging and Energizing America’s Apprenticeship Programs Act,
116-HB4238,117-HB5972,0.8145789747073433,short,LEAP Act Leveraging and Energizing America’s Apprenticeship Programs Act,
116-HR236,117-HR513,0.9825587081043038,short,Expressing the sense of the House of Representatives that welfare programs discourage marriage and hurt the institution of the family in the United States.,
116-HCR122,117-HCR55,0.9473881874391394,short,Recognizing the significance of equal pay and the disparity in wages paid to Latina women in comparison to men.,
116-HCR76,117-HCR55,0.972511949512921,short,Recognizing the significance of equal pay and the disparity in wages paid to Latina women in comparison to men.,
116-HB2885,117-HB183,0.9347816817015357,short,Veterans Collaboration Act,
116-HB5693,117-HB5365,0.9850684403159239,short,Primary Health Services Enhancement Act,
116-HB4166,117-HB6976,0.9499808629151723,short,Safe Landings Act,
116-HB1013,117-HB531,0.9335875182483592,short,ICE and CBP Body Camera Accountability Act,
116-HB4677,117-HB5990,0.9410501610871436,short,Dual Credit Innovation Act,
116-HB5303,117-HB479,0.9448942415265631,short & long,California Central Coast Conservation Act,To establish a moratorium on oil and gas leasing on public land on the Central Coast of California.
116-HB8648,117-HB1527,0.9474252282411891,long,,"To establish the Homeland Security Investigations victim assistance program, and for other purposes."
116-HB4589,117-HB9117,0.9263293831819042,short,To make permanent the authority of the Secretary of Veterans Affairs to make grants for the transportation of highly rural veterans to medical care.,
116-HB3751,117-HB4725,0.9623575257347922,short,No Student Loan Interest Act,
116-HB1896,117-HB5210,0.9399861467300168,short,Supporting Children of the National Guard and Reserve Act,
116-HB612,117-HB760,0.9587982816082813,short,Securing Our Borders and Wilderness Act,
116-HR909,117-HR90,0.9642554747630266,short,Supporting an international investigation into the handling by the Government of the People's Republic of China of COVID-19 and the impact thereof on the people of the United States and other nations.,
116-HB9002,117-HB4952,0.944511102903314,long,,To amend title XIX of the Social Security Act to provide States an option to cover a children's program of all-inclusive coordinated care (ChiPACC) under Medicaid program.
116-HB899,117-HB899,0.8912273517255735,short,To terminate the Department of Education.,
116-HB3365,117-HB5570,0.9756641844461776,short,Commission of Fine Arts District of Columbia Home Rule Act,
116-HB8809,117-HB8072,0.9565708940045102,long,,"To review the termination characterization of former employees of the Department of State who were fired by reason of the sexual orientation of such employees, and for other purposes."
116-HB5521,117-HB7387,0.9892944891920232,short,"To amend title 40, United States Code, to permit commercial filmmaking and photography on the United States Capitol grounds, and for other purposes.",
116-HB6217,117-HB2336,0.9476876748504727,long,,"To authorize the establishment of HOPE Account Pilot Projects, HOPE Action Plans Pilot Projects, and competitive grants for pilot projects."
116-HB5498,117-HB300,0.9717399108047521,long,,"To amend title 46, United States Code, to allow transportation of merchandise in noncontiguous trade on foreign-flag vessels, and for other purposes."
116-HB3341,117-HB4051,0.9710248526073294,short & long,Opioid Treatment Providers Act,To make opioid treatment programs eligible for grants under section 2008 of the Social Security Act.
116-HB7318,117-HB3633,0.9237651308637144,short,Greener Transportation for Communities Act,
116-HB4451,117-HB6596,0.9476538102978868,short,S.O.S. Veterans Caregivers Act Support Our Services to Veterans Caregivers Act,
116-HB8219,117-HB876,0.9375258266324875,long,,"To direct the Under Secretary for Health of the Department of Veterans Affairs to provide certain information to Department of Veterans Affairs medical center staff and homelessness service providers regarding the Coordinated Entry program, and for other purposes."
116-HB883,117-HB2766,0.9124964798108826,short,Families Belong Together Act,
116-HB4426,117-HB6573,0.9766617181596299,short & long,Office of Technology Assessment Improvement and Enhancement Act,"To rename the Office of Technology Assessment as the Congressional Office of Technology, to revise the functions and duties of the Office, and for other purposes."
116-HB4766,117-HB628,0.9898604385846104,long,,"To amend title 46, United States Code, to exclude certain aquaculture workers from treatment as seamen for the purpose of liability in the event of injury or death, and for other purposes."
116-HB2294,117-HB4547,0.9285120273728725,long,,"To amend the Employee Retirement Income Security Act of 1974 to establish additional criteria for determining when employers may join together in a group or association of employers that will be treated as an employer under section 3(5) of such Act for purposes of sponsoring a group health plan, and for other purposes."
116-HB1628,117-HB2530,0.9296013496108914,short,Enewetak Atoll Cleanup Radiation Study Act,
116-HB2192,117-HB3603,0.974843077952086,short,Defenders of Bataan and Corregidor Congressional Gold Medal Act,
116-HB6552,117-HB616,0.9485961067162019,short,Emergency Water is a Human Right Act,
116-HB4762,117-HB3328,0.9359448187887274,short,Fair Investment Opportunities for Professional Experts Act,
116-HB869,117-HB1477,0.930115665427554,short & long,Undetectable Firearms Modernization Act,To modernize the Undetectable Firearms Act of 1988.
116-HJR68,117-HJR78,0.9465128379719168,short,Proposing a balanced budget amendment to the Constitution of the United States.,
116-HJR55,117-HJR78,0.9571169515341653,short,Proposing a balanced budget amendment to the Constitution of the United States.,
116-HJR22,117-HJR78,0.9706462784571255,short,Proposing a balanced budget amendment to the Constitution of the United States.,
116-HJR99,117-HJR78,0.9477012258427737,short,Proposing a balanced budget amendment to the Constitution of the United States.,
116-HJR6,117-HJR78,0.9554312482001377,short,Proposing a balanced budget amendment to the Constitution of the United States.,
116-HJR108,117-HJR78,0.9563458153307987,short,Proposing a balanced budget amendment to the Constitution of the United States.,
116-HJR51,117-HJR78,0.9342201965546428,short,Proposing a balanced budget amendment to the Constitution of the United States.,
116-HB4797,117-HB1315,0.9426970818837741,short,Restoring Access Through Identification Act,
116-HCR113,117-HR657,0.9413881573494092,short,"Expressing the sense of Congress regarding the achievements of Tejano music artists such as Freddy Fender, Roberto Pulido, Flaco Jimenez, and Selena Quintanilla, in recognition of their contributions to the cultural heritage and diversity of the United States.",
116-HB8552,117-HB4596,0.9564394744835617,short & long,Student Records Protection Act,"To amend the Higher Education Act of 1965 to require institutions of higher education to establish record-management plans in order to be accredited or continue to be accredited, and for other purposes."
116-HB3745,117-HB3279,0.942809817543599,long,,"To provide physical standards and reform the inspection process for housing assisted under section 8 of the United States Housing Act of 1937, and for other purposes."
116-HB2186,117-HB2160,0.9770219908593931,short,Student Loan Refinancing Act,
116-HB8514,117-HB4797,0.898826083998774,short,Student Loan Relief Act,
116-HB1677,117-HB1244,0.9929357773049617,short,To repeal certain foreign affairs reporting requirements.,
116-HB303,117-HB303,0.7705535859827045,short,Retired Pay Restoration Act,
116-HB7936,117-HB2042,0.9452691617219386,short,Federal Employee Access to Information Act,
116-HB5450,117-HB8097,0.9572727494878396,short,"Cleaner, Quieter Airplanes Act",
116-HB7435,117-HB1600,0.9561563416275829,short,Methane Emissions Reduction Act,
116-HR1029,117-HR406,0.9700648316709302,short & long,Congressional Inherent Contempt Resolution,"Amending the Rules of the House of Representatives with respect to the enforcement of committee subpoenas to executive branch officials, and for other purposes."
116-HB2375,117-HB2891,0.9347822281717935,short & long,Preserve Access to Affordable Generics and Biosimilars Act,"To prohibit prescription drug companies from compensating other prescription drug companies to delay the entry of a generic drug, biosimilar biological product, or interchangeable biological product into the market."
116-HB3359,117-HB4052,0.9868180860092044,short,National Adoption and Foster Care Home Study Act,
116-HB2789,117-HB317,0.8870853483670081,short,To amend the Public Health Service Act to establish a health insurance Federal Invisible Risk Sharing Program.,
116-HB375,117-HB4352,0.9598416034997839,short,"To amend the Act of June 18, 1934, to reaffirm the authority of the Secretary of the Interior to take land into trust for Indian Tribes, and for other purposes.",
116-HB5204,117-HB7370,0.9523043368472668,short,Student Mental Health Rights Act,
116-HB166,117-HB166,0.9505708988019177,short,Fair Lending for All Act,
116-HJR35,117-HJR28,0.978174555969433,short,Proposing an amendment to the Constitution of the United States relative to equal rights for men and women.,
116-HB3145,117-HB3629,0.9909780534154646,short,PARK IT Act Protecting Americans from the Risks of Keyless Ignition Technology Act,
116-HB6721,117-HB1843,0.9153212063521629,short,COVID–19 Hate Crimes Act,
116-HB765,117-HB753,0.9877545346891595,short & long,"Serve the People, Not the Swamp Act","To prohibit congressional recesses until Congress adopts a concurrent resolution on the budget that results in a balanced Federal budget by the last fiscal year covered by such resolution, to establish a 5-year ban on individuals appointed to Executive Schedule positions and Members of Congress engaging in lobbying activities at the Federal level, to provide for the termination of further retirement coverage for Members of Congress under the Federal Employees Retirement System, and for other purposes."
116-HB3988,117-HB3951,0.9384770277093791,short,"To amend the 400 Years of African-American History Commission Act to extend the 400 Years of African-American History Commission, and for other purposes.",
116-HB2126,117-HB3458,0.946556706356841,short,State and Local Pensions Accountability and Security Act,
116-HB8765,117-HB1150,0.9874059268379244,short & long,Modernizing America’s Apprenticeship Act,To codify the Industry-Recognized Apprenticeship Programs of the Department of Labor.
116-HB4316,117-HB4667,0.9601654215992217,short,Public School Emergency Relief Act,
116-HB4280,117-HB3763,0.9528827330227237,long,,"To amend title XVI of the Social Security Act to update eligibility for the supplemental security income program, and for other purposes."
116-HJR64,117-HJR16,0.906439252704536,short,"Providing for congressional disapproval of the proposed transfer to the Kingdom of Saudi Arabia, the United Kingdom of Great Britain and Northern Ireland, the Kingdom of Spain, and the Italian Republic of certain defense articles and services.",
116-HB2992,117-HB6952,0.9529820615536243,short,RAISE Act Rewarding Achievement and Incentivizing Successful Employees Act,
116-HB3797,117-HB5657,0.9764848930910444,short,Medical Marijuana Research Act,
116-HB1721,117-HB910,0.9333670586935481,short,Veterans Healthcare Improvement Act,
116-HCR44,117-HCR72,0.9376008568355563,short,"Directing the Joint Committee on the Library to revise the statue commemorating women's suffrage which is located in the rotunda of the United States Capitol, commonly known as the ""Portrait Monument"", by placing on the statue an inscription which is based on the original inscription which was on the statue when the statue was delivered to the United States Capitol in 1921, and for other purposes.",
116-HB8568,117-HB828,0.980217564076246,short & long,PREPARE LTC Act Promoting Restoration of Emergency Preparedness and Advancing Response to Epidemics in Long-Term Care Act,"To amend title XVIII and title XIX of the Social Security Act to codify certain infection control and emergency preparedness regulations, to prohibit a reduction in the frequency of surveys of skilled nursing facilities and nursing facilities, to prohibit the waiver of certain reporting requirements, and for other purposes."
116-HB6204,117-HB2192,0.9592411955172936,long,,"To provide for recovery by individuals who were stationed, lived, or worked at Camp Lejeune, for certain actions of omissions by the United States."
116-HB6236,117-HB6978,0.9484119487000984,long,,"To amend the Higher Education Act of 1965 to provide for certain freedom of association protections, and for other purposes."
116-HB3128,117-HB6978,0.9413800552404076,short,Collegiate Freedom of Association Act,
116-HB7386,117-HB3333,0.9535736222051937,long,,"To ensure that federally backed financing for the construction, rehabilitation, or purchase of manufactured home communities is available only for communities whose owner has implemented minimum consumer protections in the lease agreements with residents of all manufactured home communities owned by such owner, and for other purposes."
116-HB3682,117-HB5493,0.9281417254824321,short,Land Grant-Mercedes Traditional Use Recognition and Consultation Act,
116-HB6046,117-HB3478,0.8583533765216037,short,Castle Pines Community Act,
116-HR278,117-HR411,0.948014246807969,short,Expressing the sense of the House of Representatives to recognize the crisis of violence against Native women.,
116-HB7556,117-HB7504,0.976507172324345,short,To amend the Internal Revenue Code of 1986 to make a portion of research credit refundable for certain small businesses engaging in specified medical research.,
116-HB2504,117-HB2249,0.942726907813884,short,Willie O’Ree Congressional Gold Medal Act,
116-HB8177,117-HB2934,0.9678158690668166,short,RAISE Act Renal Anemia Innovation Support and Expansion Act,
116-HB749,117-HB1147,0.9667560500546446,short,Veterans Right to Expediency Act,
116-HB5985,117-HB5207,0.9331790725833922,short,Foreign Robocall Elimination Act,
116-HB2313,117-HB4647,0.9597930512001421,short,Water Conservation Rebate Tax Parity Act,
116-HB113,117-HB8071,0.9387762603592785,short,All-American Flag Act,
116-HR676,117-HR113,0.9551201885129046,short,Expressing the sense of the House of Representatives that the United States should formally withdraw from the Paris Agreement.,
116-HB8642,117-HB318,0.9544531410694628,long,,"To amend title XVIII to provide coverage and payment for certain tests and assistive telehealth consultations during the COVID-19 emergency period, and for other purposes."
116-HB1853,117-HB4778,0.9510002069637481,short,District of Columbia Courts Vacancy Reduction Act,
116-HB7873,117-HB4049,0.9005807285543808,long,,"To amend the Public Health Service Act to give a preference, with respect to project grants for preventive health services, for States that allow trained individuals to carry and administer epinephrine, and for other purposes."
116-HB3723,117-HB4712,0.984600851570439,short,Desalination Development Act,
116-HB577,117-HB1078,0.9737895191529743,short,Prohibiting Perks and Privileges Act,
116-HB784,117-HB1080,0.9883818705187075,short,Pain-Capable Unborn Child Protection Act,
116-HB8939,117-HB1080,0.9765040291115693,long,,"To amend title 18, United States Code, to protect pain-capable unborn children, and for other purposes."
116-HB3370,117-HB4780,0.9853321683753696,short,Refuge System Protection Act,
116-HB8392,117-HB2352,0.9442968865978436,short,Honoring National Recovery Month Act,
116-HB3064,117-HB9120,0.9664407032986287,short,Baltic Reassurance Act,
116-HB7495,117-HB1987,0.9762107594492737,short & long,WORK NOW Act Work Opportunities and Resources to Keep Nonprofit Organizations Well Act,"To help charitable nonprofit organizations provide services to meet the increasing demand in community needs caused by the coronavirus pandemic, preserve and create jobs in the nonprofit sector, reduce unemployment, and promote economic recovery."
116-HB2867,117-HB748,0.9817413261874075,short & long,Ethan's Law,"To amend chapter 44 of title 18, United States Code, to require the safe storage of firearms, and for other purposes."
116-HB1162,117-HB1015,0.9395229969100682,short,Water Recycling Investment and Improvement Act,
116-HB5774,117-HB5938,0.9847252906296371,short,Veterans HOPE Act Veterans Heroin Overdose Prevention Examination Act,
116-HB1802,117-HB845,0.9774863879751431,short,VA Billing Accountability Act,
116-HR49,117-HR117,0.9201882762691905,short,Supporting Coptic Christians in Egypt.,
116-HB8739,117-HB7093,0.9868240385629075,short,"To withdraw certain Federal land in the San Bernardino National Forest in California from location, entry, and patent under mining laws, and for other purposes.",
116-HB8738,117-HB7093,0.9351195225255358,short,"To withdraw certain Federal land in the San Bernardino National Forest in California from location, entry, and patent under mining laws, and for other purposes.",
116-HB3497,117-HB2037,0.8823208092038908,long,,To extend Federal Pell Grant eligibility of certain short-term programs.
116-HB4948,117-HB506,0.8897220498502951,long,,To provide for the effective use of immigration detainers to enhance public safety.
116-HR733,117-HR97,0.9110942463091897,short,Reaffirming the importance of the United States relationship with the Dominican Republic.,
116-HB7279,117-HB5554,0.9176560863869071,long,,"To amend title 11 of the United States Code to prohibit the payment of bonuses to highly compensated individuals employed by the debtor and insiders of the debtor to perform services during the bankruptcy case, and for other purposes."
116-HR881,117-HR1008,0.9286550657372811,short,Supporting the goals and ideals of National Women's History Month.,
116-HR171,117-HR1008,0.9281134256357476,short,Supporting the goals and ideals of National Women's History Month.,
116-HB8681,117-HB6997,0.9586500938035927,short,Stopping the Fraudulent Sales of Firearms Act,
116-HB469,117-HB3415,0.9481300170271276,short,"To require the use of replacement cost value in determining the premium rates for flood insurance coverage under the National Flood Insurance Act, and for other purposes.",
116-HB9067,117-HB3543,0.8716085771234212,long,,To establish an office within the Department of Commerce to coordinate all non-defense related deployment and activities related to blockchain technology within the Federal Government.
116-HB2201,117-HB2269,0.9626884684844067,short,"To modify the presumption of service connection for veterans who were exposed to herbicide agents while serving in the Armed Forces in Thailand during the Vietnam era, and for other purposes.",
116-HB3249,117-HB2291,0.9267882071300487,short,Financing Our Energy Future Act,
116-HB2083,117-HB2915,0.9396919783876975,short,HOPR Act Homeland Procurement Reform Act,
116-HB5889,117-HB1790,0.9319420650584382,short,Fair Indexing for Health Care Affordability Act,
116-HB5291,117-HB1790,0.9680417237779382,short,Fair Indexing for Health Care Affordability Act,
116-HB7621,117-HB2761,0.957735172064315,short,Comprehensive National Mercury Monitoring Act,
116-HB5434,117-HB3281,0.9789140549233324,short,RPM Act of 2019 Recognizing the Protection of Motorsports Act of 2019,
116-HB2351,117-HB4068,0.8992601081723658,short,Protecting Airport Communities from Particle Emissions Act,
116-HB1153,117-HB3779,0.9281944532145072,short,Reaching English Learners Act,
116-HB7577,117-HB4700,0.956940654918647,short,Transition for Success Act,
116-HB6854,117-HB8696,0.9669811648478223,short,Stop Scam PACs Act,
116-HB4949,117-HB293,0.9429257447751102,short,VA Hospitals Establishing Leadership Performance Act,
116-HB179,117-HB247,0.9473200343363697,short,"Acre In, Acre Out Act",
116-HB1413,117-HB4544,0.9385845142707848,short,WORK Act Workforce Opportunity Realignment Kickstart Act,
116-HB1724,117-HB6666,0.9912657741575228,long,,To amend the Higher Education Act of 1965 to improve the financial aid process for homeless and foster care youth.
116-HB4243,117-HB769,0.9062718895087998,short,Rural MOMS Act Rural Maternal and Obstetric Modernization of Services Act,
116-HB1632,117-HB1083,0.9445740761918121,short,Southeast Asia Strategy Act,
